id,product,summary,embedded_value,access_level,processing_level,categories,problem,solution
100,Integrated cycle for waste collection,Tax-reducing integrated waste collection cycle,0.5,0.30000000000000004,0.5,['PARTNERSHIP'],"The increasing production and improper disposal of plastic waste is harming the environment, economy, and public health as a global issue. This excess waste can have a second life through recycling and reusing, but lacks efficient measures for doing so.  ","Implement Fused Deposition Modeling (FDM) 3D printing technology. This technology breaks down plastic waste and remolds it into a printable filament that can be used to create new, reusable products significantly reducing plastic waste. This could revolutionize recycling and waste management programs, transitioning from a linear disposable model to a circular model. Inexpensive and portable, this solution is highly scalable since the machines are widely affordable. Its flexibility allows for diverse product output, ranging from everyday household items to components for other industries. This shift could encourage responsible and sustainable use of resources, fostering an economy that benefits both businesses financially and the environment."
101,Closed-Loop Clothing Service,Closed-Loop Clothing Service combines leasing with recycling technology to minimize fashion's environmental impact.,0.7000000000000001,0.30000000000000004,0.7000000000000001,"['RPO', 'DFR']",Proposal for waste collection for tax reduction,Integrated cycle for waste collection
102,Clay Pots,"Eco-friendly clay pots to replace plastic cups for beverages, reduce pollution, and offer health benefits.",0.30000000000000004,0.2,0.2,"['DFR', 'PLE']","The central problem remains the same â the massive environmental footprint of the clothing industry, worsened by the trend of fast fashion, and the need for a solution that not only reduces this impact but also provides a sustainable, profitable business model.  ","In addition to the previously mentioned CaaS model, a significant opportunity lies in combining it with fabric recycling technology, creating a complete 'Closed-Loop Clothing Service'. Going beyond leasing, this service would involve taking returned clothes, regardless of their condition, and recycling them into new textile fibers.   The recycling process uses less energy and water than producing new fibers and reduces the dependence on virgin resources. It also offers a solution to worn-out clothes that can no longer be repaired or leased, presenting another revenue stream by selling recycled fabrics or products back to consumers.  Moreover, the significant reduction of waste and less need for raw materials can enhance the profitability by both minimizing costs and creating value from 'waste'. Additionally, it also opens up new markets, such as selling sustainable recycled fabrics to other brands, yielding a diversified and increased financial impact.   While technology does play a considerable role in managing the life-cycle of garments and enhancing recycling processes, the concept's scalability primarily lies in the global problem it is addressing, the environmental impact of fast fashion, making it translatable to various locales and marketplaces. Thus, leading to a higher potential for implementation success."
103,shoes,"Collect and donate shoes to aid business startup in developing countries, reduce waste.",0.30000000000000004,0.2,0.2,"['PARTNERSHIP', 'PLE']","Plastic pollution is a big problem in the world, specially in the modern cities where we use plastic pots to drink tea and coffee. ","Clay Pots can be use to drink tea and coffee. Tea shops can replace plastic and glass containers with clay pots for people to enjoy tea in. This not only benefits the consumer but also the shop owner as clay pots cost less than plastic cups and theyÕre also more popular. Clay pots are biodegradable, hence can be thrown or broken, it won't be hazardous like plastic.They are cheaper than plastic or glass containers. They provide an earthy aroma to the beverage, which no other material can provide. They cannot be re-used, so you don't have to worry about the germs and bacteria lingering around. Foam and plastic cups contain chemicals that can harm our body and stomach. The advantage of drinking tea in a clay pot is that the organic product is chemical-free and one doesnÕt need to worry about any side effects.

So clay pots are an eco friendly and a healthy solution to replace the plastic pots. "
104,community-based rental service platform,Community-based AI-driven rental platform to reduce overproduction and promote goods sharing.,0.5,0.2,0.1,"['RPO', 'PLE']","In developing countries, many individuals lack sustainable income sources, and there's an excess of discarded shoes contributing to environmental waste in developed nations.  ","""""Soles4Souls"""" provides a dual solution to these pressing issues. By collecting and donating unwanted shoes from developed countries, they propel an eco-conscious effort to divert waste from landfills. These shoes are then used to empower individuals in developing countries, facilitating them in setting up their own businesses to refurbish and sell these shoes. This initiates a circular economy, while drastically improving their livelihoods and promoting environmental sustainability."
105,assessment methodology and scoring approach,Software to streamline installations by closing apps and providing instructions.,0.7000000000000001,0.15,0.1,[],"Overproduction in manufacturing industries creates financial and environmental burdens due to resource wastage and storage costs. The long-term sustainability of traditional centralized production models is questionable, considering shifting consumer demand patterns and environmental concerns.  ","My solution is a community-based rental service platform that encourages reusing and sharing infrequently used goods, powered by advanced AI for demand prediction.   In this model, instead of encouraging mass production, we encourage consumers to list their rarely used items (like camping tents, power tools, etc.) and rent them to others in their locality when required. A digital platform can facilitate this, keeping an inventory of available items and managing transactions. This way, we reduce the need for each household to own seldom-used items that become dormant after one use.   To improve demand prediction and thus reduce overproduction, the platform can incorporate an AI prediction model. It uses historical rent data, consumer behavior, and trends to forecast future demand and recommend production accordingly. This allows manufacturers to better plan their production, reduce waste, and accommodate fast-changing consumer needs.   The implementation of this idea is quite feasible and scalable. The platform will have a lower setup and running cost compared to manufacturing units as it primarily involves software and server costs. In terms of scalability, the platform can be scaled up easily by expanding to new locations and including more categories of items for rent.  The environmental impact is significant as it reduces overproduction, promotes reusage, and maximizes product lifecycle. It could also save consumers money on buying rarely used items, provide extra income for those who rent out their items and reduce the financial burden on manufacturers, allowing for more cost-efficient production."
106,Biodegradable Packaging as a Service,"AI-enhanced biodegradable packaging service using local materials for scalable, eco-friendly solutions.",0.7000000000000001,0.2,0.25,"['RPO', 'DFR', 'PARTNERSHIP']",whenever install a software close other program and read the instructions,Select your assessment methodology and scoring approach
107,Recycled Paper Art,"Art project transforms paper waste into art in Ibadan, creating jobs and promoting sustainability education.",0.45,0.25,0.2,"['DFR', 'PARTNERSHIP']","The plastic waste issue demands an economical, scalable, and environmentally friendly solution that addresses both plastic pollution and energy/resource consumption.  ","Biodegradable 'Packaging as a Service' model enhanced with local sourcing and AI. âPackaging as a serviceâ concept remains, but the model is iterated by focusing on locally sourced, biodegradable packaging materials (like mycelium, bamboo, or bagasse) in the production of reusable containers. This reduction in transportation-related carbon footprint makes the solution more environmentally friendly. The cleaning process will involve environmentally friendly cleaners reducing water and air pollution.   To make it a financially feasible choice for businesses, the 'Packaging as a Service' model will be supported by AI algorithms for efficient logistics â predicting when and where containers will be needed and coordinating the return, cleaning, and redeployment process.     This solution is easier to implement than completely shifting to traditional reusable containers as it requires less intensive cleaning. Reduced reliance on plastic and use of locally sourced materials further enhances its sustainability. High scalability is ensured as businesses of different sizes can tailor the use of services based on their needs, while AI enables efficient logistics and cost management. Novelty lies in the combination of biodegradable materials, local sourcing, AI logistics, and the circular economy principle in one unified solution."
108,Biochar,"Biochar production from organic waste reduces carbon footprint and enhances soil fertility, scalable modular units.",0.7000000000000001,0.25,0.45,"['DFR', 'PARTNERSHIP']","Rapid deforestation due to paper production, increasing waste, unemployment, and lack of sustainability awareness within West Africa's largest city, Ibadan City, in Nigeria.  ","Initiate an African Kid Recycled Paper Art Project that repurposes paper waste to create art products, stimulate local employment, educate on sustainability and environmental conservation, and ultimately reduce the need for new paper products, promoting a circular economy and mitigating climate change.  The improvement to the problem and the solution would look something like this:  Problem: Deforestation and paper waste pollution are major environmental issues in Ibadan City, Nigeria. The overproduction of paper contributes significantly to these issues, while unemployment remains high. A lack of sustainability awareness exacerbates these problems.  Solution: The African Kid Recycled Paper Art Project proposes a powerful vehicle for environmental improvement and job creation. By reusing paper waste to create art, we stimulate the circular economy, slashing paper waste and the need for new paper, reducing deforestation and pollution. The project will foster local employment within the recycling and creative industries. Simultaneously, it serves an educational purpose, encouraging a societal shift towards sustainable practices. This endeavor has potential for scalability and adaptation in other regions facing similar issues. It promises economic, environmental, and social value, aligning with the principles of the circular economy."
109,dynamic pricing algorithm,AI dynamic pricing algorithm reduces food waste and increases retailer revenue by optimizing perishable product discounts.,0.8,0.2,0.1,['RPO'],"The current linear economic model not only increases our carbon footprint but also contributes to the inefficient waste management system. Yielding waste and releasing excess carbon dioxide (a greenhouse gas) into the atmosphere, this model escalates the global climate crisis. Furthermore, businesses within this model are subjected to higher operational costs due to waste disposal and constantly sourcing raw materials.  ","Introducing the production and utilization of Biochar â a type of charcoal formed by converting organic waste in a low-oxygen environment. This process known as pyrolysis not only helps in waste reduction but also sequesters carbon hence reducing the amount of carbon dioxide released into the atmosphere. When used as a soil amendment, Biochar enhances soil fertility hence aiding agricultural businesses while sequestering carbon dioxide. Additionally, it can replace some materials in construction, thus providing a low-cost alternative to businesses in the construction sector and creating a new value chain in the recycling industry. The modular nature of biochar production units makes this solution feasible and highly scalable."
110,Digital Clothing Libraries,Blockchain-based digital clothing library for sustainable virtual fashion leasing.,0.7000000000000001,0.1,0.1,['RPO'],"Roughly 1/3 of all food produced for human consumption goes to waste. 87% is caused by
perishable items. Waste caused by perishable products in supermarkets and online grocery stores has a negative effect on the environment in addition to the financial loss. ","To help reduce the waste caused by perishable products in supermarkets and online grocery stores, a food waste solution has been developed by Wasteless. It is a proprietary dynamic pricing algorithm for products based on their expiration date. This allows retailers to deploy AI to mark off prices on perishable products. The system is managing the inventory of fresh products in relation to expiring dates and the consumerÕs attitudes towards them. WastelessÕs pricing engine employs a branch of machine learning called ÇReinforcement LearningÈ. This allows the pricing engine to quickly learn how consumers respond to dynamic pricing so it can then find the optimal discounting policy. The retailers will achieve a remarkable increase in revenue by optimizing pricing and incentivizing their shoppers to buy products that would otherwise go to waste. Suppliers will leverage prices to consumers to better match supply with demand, reduce overstock situations, and ensure constant product availability at the point of sale."
111,service,"Eco-friendly service-based business model focusing on product longevity, renewability, sharing, and resource restoration.",0.7000000000000001,0.1,0.2,"['RPO', 'PLE', 'DFR', 'PARTNERSHIP']","Unsustainability of the fashion industry due to overproduction, resulting in environmental degradation, and financial burden on consumers who feel constant pressure to keep up with changing fashion trends.  ","A circular economy model utilizing blockchain technology to create """"Digital Clothing Libraries"""". Customers can lease digital versions of garments from a library for use in the virtual world (social media, virtual meetings, online gaming, and augmented reality platforms). Once the leasing period is over, digital clothes are returned and leased out again.  Consider the novel concept of digital fashion, where clothes exist virtually and are superimposed onto photographs or avatars. This model eliminates the environmental impact of traditional manufacturing, transportation, and waste. From a financial perspective, it creates an entirely new revenue stream without the inventory and logistic costs that physical clothes rental requires. Furthermore, businesses can scale quickly as there is no physical inventory to maintain, and clothing items can be leased out simultaneously to numerous customers. Plus, it caters to the growing world of social media, online gaming, and virtual reality where presentation of oneself in the digital space is increasingly important."
112,Fashion Rental and Repair Subscription Service,Fashion rental and repair subscription service to reduce textile waste and promote sustainable consumption.,0.55,0.15,0.2,"['RPO', 'PLE']","Waste in raw and used materials, commodities and energy","TREATING THE PRODUCT AS A SERVICE:
 By producing resources and dematerializing, the organization can sell benefits without selling ownership of the product, so what the customer pays is for the benefits of the product, not ownership.

 INCREASED PRODUCT LIFE:

 Ensuring the longevity and durability of the product by repairing, re-manufacturing, updating and selling it again. The use of technology in product improvement is the best example of managing resources wisely.

 RENEWAL:

 The organization can offer clean alternatives to toxic, polluting and non-recyclable products through the use of recyclable and biodegradable materials. This requires designing modular products that can be disassembled, upgraded and reused so that biological resources can be returned to nature.

 SHARING PLATFORM:

 Creation of product distribution and sharing platforms for (rental and rental) based models. It is possible to create distribution platforms that enable users to rent, exchange or borrow goods.

 RESTORE RESOURCES:

 The organization can reduce raw material costs through reuse, recycling and recovery of materials from by-products and waste, as well as its ability to explore new products and revenue models, leading to self-sufficiency"
113,e-waste recycling initiative,Innovative e-waste recycling initiative to repurpose materials and reduce electronic waste through trade-in programs.,0.7000000000000001,0.4,0.85,"['DFR', 'PARTNERSHIP']","The apparel industry is currently considered the second-largest pollutant in the world. Fast fashion has led to a significant increase in textile waste due to a rise in demand, lack of quality in materials, and micro-seasons. Consumers often buy clothes, wear them a few times, and then discard them. The waste then goes to landfills contributing to environmental degradation.  ","My solution is to create a 'Fashion Rental and Repair Subscription Service'. This model would allow users to borrow clothes for a specified period. Instead of purchasing clothes, they rent them, changing their wardrobe as many times as they wish during their subscription period. This would discourage the purchase of low-quality, disposable fashion items for only a few uses.  In addition, this service would also offer repair services. If an item gets damaged, the user can send it to the repair service instead of discarding it. It is important to note that the clothing items will be made from high-quality, durable materials that are designed to last, promoting mindful consumption, and contributing to resource efficiency.  The financial impact for businesses would be noticeable. Businesses would no longer need to keep up with the fast-changing trends and dispose of unsold items. They can rather focus on creating high-quality items and maintaining an inventory that can be circulated among the subscribers, leading to a stable and predictable revenue stream. The nature of this model allows it to be both feasible and scalable, with the ideal tools being an app or a digital platform that handles subscriptions, deliveries, and returns. Not only would this idea reduce the environmental impact of the fashion industry, but it would also revolutionize how consumers interact with fashion."
114,"recycling programs, clothes for longevity, repurposed construction materials, efficient production systems, product recovery mechanisms",Multifaceted circular economy approach to reduce waste and extend product lifespans across industries.,0.55,0.25,0.75,"['DFR', 'PLE', 'PARTNERSHIP']","Every year, billions of phones, laptops, and other electronics become obsolete, leading to an increasing amount of electronic waste (e-waste). Not only does this waste space in landfills, but it also contributes to environmental pollution as harmful substances such as mercury and lead leach into the soil and groundwater.  ","We propose an innovative e-waste recycling initiative focused on repurposing and recovering valuable materials from obsolete electronics. Businesses can actively participate in this by offering trade-in programs, where old devices can be exchanged for a discount on new products. This initiative prompts businesses to partner with electronic manufacturers that ensure end-of-life devices are properly disassembled, and valuable materials like gold, silver, and palladium are recovered and used in the production of new devices. This method could have profound environmental benefits by reducing the demand for new material mining and curbing e-waste accumulation.   Moreover, there is substantial economic potential in this approach. According to a report by the United Nations, e-waste contains deposit materials worth billions of dollars that are largely unused currently.   To further enhance the feasibility and scalability of this solution, businesses could collaborate with local governments and NGOs to set up community e-waste collection and recycling hubs, raising awareness about the value and importance of proper e-waste disposal.   Lastly, another aspect that could play a significant role to ensure the success of this initiative is to implement supportive regulatory measures and incentives for businesses and manufacturers who abide by green procedures and demonstrate significant efforts in implementing circular economy practices in their operations.   This way, we believe the e-waste challenge can be turned into a business opportunity while making a measurable impact on environmental protection â a win-win for all stakeholders involved."
115,Green Tech-Powered Circular Economy model,"Green Tech boosts Circular Economy efficiency, minimizes waste, and prolongs product lifecycles.",0.8,0.35000000000000003,0.85,"['PLE', 'DFR']","The textile industry produces a significant amount of fabric waste and short lifespan products. Simultaneously, the construction industry struggles with low-value materials and the wastage of rods and concrete. Meanwhile, the electronics industry grapples with production loopholes and short-lifecycle products. These issues contribute to extensive environmental pollution and resource depletion.  ","Letâs create diverse, industry-specific circular loops. In the textile industry, we could introduce recycling programs and design clothes for longevity. Construction companies could repurpose discarded rods and concrete, collaborating with other industries to accommodate these items. The electronics industry could invest in efficient production systems and robust product recovery mechanisms. Additionally, launching cross-industry collaborations can redefine âwasteâ into valuable inputs for other sectors. Furthermore, to extend products' lifespan, companies could recover and recycle materials already disposed of. These environmentally and financially beneficial practices will set us on a path towards sustainability, making substantial strides towards both reducing waste and enhancing profit, thereby nurturing our precious planet."
116,e-waste collection mechanism,Direct e-waste collection from consumers with rewards for responsible disposal.,0.4,0.25,0.85,"['DFR', 'PARTNERSHIP']","Rapid resource depletion and increased waste generation are major problems due to the prevalent take-make-waste linear economy model. This model, leading to dire environmental consequences, hinders global sustainability efforts and increases carbon emissions.   ","To tackle this issue, we propose a Green Tech-Powered Circular Economy model. Merging technology with circular economy principles can create a robust solution resulting in amplified environmental advantages. Here, businesses would leverage green technologies (like AI, IoT, and blockchain) to track and manage resource usage, waste generation, and recycling in their operations. For instance, IoT can be used to monitor product lifecycles, ensuring optimal use and timely repairs to prolong the lifespan of items. AI could aid in effective waste sorting and recycling, identifying materials that can be reprocessed and reused in production. Blockchain can make the supply chain transparent and traceable, encouraging responsible sourcing and consumption. This tech-empowered system optimizes resource-use, minimizes waste, and boosts operational efficiency. It not only reduces the pressure on natural resources and the environment, it maximizes efficiency and improves profits. This approach is versatile and scalable, applicable to businesses of all sizes and sectors. With continuous advancements in technology, the feasibility of its integration with circular economy principles only becomes stronger."
