id,product,summary,embedded_value,access_level,processing_level,categories,problem,solution
55,Hardware-as-a-Service (HaaS) subscription,Subscription-based electronics to reduce e-waste,0.7000000000000001,0.2,0.7000000000000001,"['RPO', 'PLE', 'PARTNERSHIP']","Rising environmental concerns have led consumers to demand companies for more sustainable practices. While attempts to reuse plastics have been largely voluntary and inconsistent, businesses need a model that encourages plastic recycling while creating significant financial gain.  ","My proposal is the """"Plastics Profit Cycle,"""" a solution that not only encourages businesses to recycle and use recycled plastics but also creates substantial profit from it. In this model, businesses still collaborate to create a circular plastic economy, similar to the original model. However, we introduce strong incentives for participating businesses such as tax breaks, reduction in waste disposal fees, and an option to profit from the waste by selling it to recycling companies. This solution goes beyond merely reusing and recycling to create a system where plastic waste becomes an asset rather than a cost. Furthermore, we include a sustainability rating system that provides businesses with a ranking based on their participation in the Plastics Profit Cycle. This ranking could be used in marketing efforts, reinforcing the company's commitment to sustainable practices and boosting their public image. The structured incentivization combined with a rating system could prompt more businesses to join the cycle, enhancing its financial and environmental impact while increasing its feasibility and scalability."
56,digital platform ('Leftovers for Life'),Digital platform connecting restaurants to donate surplus food to local food banks and individuals.,0.4,0.2,0.1,['PARTNERSHIP'],"E-waste represents 70% of the toxins in our landfills despite being only 2% of the waste. The reduction and responsible management of this form of waste is a pressing issue. The linear model of electronics consumption, """"use and discard,"""" intensifies the problem as it causes a significant amount of valuable materials to be wasted.   ","A platform that connects electronics firms, recyclers, and consumers could reconfigure the linear electronics industry into a circular economy. The concept is a 'Hardware-as-a-Service (HaaS)' model. It changes the concept of consumer electronics from something people buy and dispose of, to a service that they subscribe to.  Customers would no longer buy electronic products; instead, they would subscribe to them. Once subscribing to a smartphone, for example, they would receive a phone and pay a monthly subscription fee to use it. When the phone breaks down or the user wants to update it, the company would provide a new phone, and the old one would be returned.  Returned gadgets would then be sent to specialized companies for refurbishment and repair, keeping the valuable materials inside phones in use longer and reducing the demand for new materials. Non-repairable electronics would be sent to an e-waste recycling partner to safely recover precious metals and reduce the amount of e-waste going to the landfill.  For this to work, greater collaboration is required between manufacturers, tech companies, refurbishers, and recyclers. The business model presents a unique and innovative solution for electronics consumption and waste. It reduces environmental impact by reducing e-waste and the exploitation of resources.   The model also offers companies potential cost savings in raw material procurement and waste management, and consumers get the benefit of lower prices for electronics. Moreover, it has a high feasibility as we see emerging trends towards servitization and 'product as a service,' particularly in tech industries. This model could potentially be expanded and adapted to other consumer goods sectors, indicating high scalability."
57,organic compost and bio-pesticides,Turning crop waste into organic compost and bio-pesticides to reduce chemical use and enhance soil health.,0.45,0.2,0.30000000000000004,"['DFR', 'PARTNERSHIP']","The prevalent problem of food surplus wastage in the hospitality industry, especially in restaurants and hotels, is contributing significantly to the accumulated waste and is missing an opportunity to redirect nourishing food to those in need.   ","A digital platform ('Leftovers for Life') can be developed that enables restaurants and hotels to list their surplus food available for pickup. The application would allow both individuals and local food banks or shelters to claim the listed food. Restaurants and hotels would specify a pick-up time convenient for them, ensuring their operations are not disrupted. This solution not only reduces food waste, thus addressing environmental concerns, but also provides substantial cost savings opportunities for businesses by potentially claiming tax benefits for the donated food items.   To maintain the quality of food, a system would be in place for businesses to share detailed information about the food, such as preparation date and time, and suggested consumption duration. Notifications and reminders would be sent to the recipients to ensure prompt pickup and consumption. The platform, being digital, is highly scalable and can be launched in different geographies given the widespread nature of the problem. Implementation might face challenges in initial acceptance and behavioral change, but campaigns and educating about food wastage and its environmental impact, along with tax benefits, will ensure the feasibility of the project."
58,Meal-Brick,Meal-Brick and Sleep-Safe provide quick-deploy shelters and life-saving protection post-disaster or conflict.,0.7000000000000001,0.2,0.65,"['DFR', 'PLE']","Increasing agricultural practices contribute massively to environmental degradation due to the overuse of chemical fertilizers, pesticides, and herbicides. In addition, many farmers face economic challenges due to the high costs of these agricultural inputs.  ","We propose robust 'Crop Bio-Waste Recycling' networks, wherein agro-based industries partner with farmers to utilize crop residue and food waste to produce organic compost and bio-pesticides. Through this initiative, businesses in the agricultural sector can convert agricultural waste into valuable commodities, significantly reducing the industry's reliance on harmful chemical products. Furthermore, this could help address the burning issue of crop residue, a practice commonly done that contributes enormously to air pollution.  With a focused approach on local partnership networks, the environmental impact of this solution could be substantial, measuring in decreased pollution levels, improved soil quality, and enriched biodiversity. At the same time, the financial impact for both farmers and the agri-business sector is promising with cost savings in raw materials and enhanced productivity due to healthier soils.   The feasibility and scalability of the solution are pragmatic as it capitalizes on existent resources and requires minimal technical know-how. Governmental support via incentives or subsidies could further promote this innovation, making it a sustainable flagship example of circular economy in the agricultural sector."
59,Clothes-as-a-Service,Clothes leasing service to reduce textile waste and promote recycling in fashion.,0.55,0.2,0.25,"['RPO', 'PLE', 'PARTNERSHIP']","Every year at some location on the planet there are natural disasters such as earthquakes, mudslides, floods, volcano eruptions, tsnamis, forest fires, and man-made disasters emanating from terrorism, wars or local tribal fighting. There is one constant result: people die from exposure to the elements, from direct personal violence, from the loss of their homes to quick flowing water or mud or falling buildings. Finding shelter in a rainy environment, at night, is extremely difficult.  Living exposed to weather conditions, particularly when the temperature falls below 50 degrees F., especially for a family, is beyond stressful.

The consuming nations of the world, especially when there are no local natural disasters requiring nearly constant attention, accumulate an abundance of plastic materials including water bottles, containers, toys, part-plastic partitions,  which those same nations have developed recycling facilities that turn varying plastic materials into other more useable plastic material. Certainly one of the easiest products to make is called the Meal-Brick(TM R).

A Meal-Brick(TM,R) is a recycled, clear, or colored walled, FOLDABLE, EXPANDABLE, iNTERLOCKING, CUBE OR SQUARE  or  Rectangular PLASTIC CONTAINER of various sized walls, sides, top and bottom where 'Living Hinges' from the same or similar plastic are strategically placed to permit the cube to FOLD in-ward/outward/downward/upward so that in expanded state it might measure 12"""" X 12"""" X 12"""" or any fraction thereof and which can be stacked together and banded with PVC wrapping either as expanded cubes or, alternatively, can be folded down so that the sides and tops of each cube touch themselves and where one cube may touch other similar cubes in a larger pallet sized square so that, even 1500 similar squares, that, will float can be air-dropped so that two such pallets, together with 'tarps' as roofs, could be stacked one atop of another and which are not only designed to interlock via plastic-tits together but with each set in a manner that stakes of wood or iron shaped and reshaped from local detritus caused from former, now fallen, structures and so locked but such detritus as to make sturdy walls, including openings for windows and doors (also from detritus) sufficient to house a family of at least 12 people.

Meal-Brick can arrive full folded to thus serve as components of construction (with a house-shelter capable of being assembled/erected within 4 hours thus providing overall shelter in a 24 hour period for 72 people. The cost of each PLASTIC BRICK, manufactured in factories by 100,000 per day shall be supplemented by the World Bank and Contributing Countries @ 1 US Dollar/Brick. The Bricks may also be delivered with folding internal compartments and rigidity structures already full of bottles of water, packets of crackers, Meal-Ready-to-Eat, Basic Medicines, Water Purifying tablets, and anything else that could be packed into the 12"""" x 12""""x12"""" (or smaller cubic, rectangular, square) container interior space.

Air-Dropping onto grass-lands, hedge-groves, near shores of streams and rivers, or ocean shores permits rapid deployment and delivery of required food-stuffs and medicines, and shelters at minimum costs especially since it is anticipated that pre-positioning of these supplies could be arranged in areas threatened by disaster,  terrorism, and conflict. 

Images of Meal-Brick both in a Foldable and in a Filled state are attached.

While Meal-Brick offers a near permanent shelter since the assembled houses, once built will sustain weathering for as long as 5 years.
 A less permanent shelter, call SLEEP-SAFE (PAT. PEND.) IS also included.  Sleep-safe, Is a protective covering made from Kevlar-like anti-ballistic cloth with strategic pockets place on its perimeter and side that will hold further anti-ballistic, plastic, wood, and metal plates designed and positioned to prevent shrapnel  and the detritus from nearby explosions NOT to Penetrate. Further Sleep-Safe is set up on Plasticized/Metal Rigging so as to achieve an assembled shape of the Abrams Battle Tank Turret so as to further retard projectiles and shrapnel.  Sleep-Safe may also be hung along walls or openings to provide further protection with each such Sleep-Safe covering measuring 6' x 8'.  With the use of heavy zippers, Sleep-Safe may be re-configured into a ground covering such as the covering over a Fox-Hole. Further, the cover may be reconfigured using the Zippers as a PERSONNEL PONCHO so that individual Sleep-Safe covers become wearable individual protection for soldiers or combattants.



 ","There are no solutions available for those who have suffered natural calamity or those continuing to suffer the effects of warring countries. Meal-Brick will save lives the very day they are dropped or delivered for use anywhere. They are designed to take instant advantage of any venue in which they are needed.  People will instantly understand how they are to be used and their contents will save lives immediately.  Sleep-Safe(R, Pat Pend) can similarly be air-dropped and will provide instant life-saving protection.  Further, Sleep-Safe can be easily reconfigured to provide protection for walls of apartment structures as well as battle-hospitals."
60,portable garages,Recycling cargo containers into portable urban parking garages,0.45,0.35000000000000003,0.35000000000000003,"['DFR', 'RPO']","Today, millions of tons of textile waste end up in landfill, leading to severe environmental damage. The fashion industry is one of the most polluting industries in the world and is primarily linear, meaning it produces a significant amount of waste that is not effectively reused or recycled.  ","A 'Clothes-as-a-Service' model could transform the fashion industry. Under this model, brands maintain ownership of the clothes and lease them to customers for a period. This service allows customers to get the style and variety they want, discouraging the tendency for impulse purchases that end up in the landfill. Once clothes are returned, they are cleaned, repaired, and leased again. When they are no longer rentable, these clothes can be recycled in a way that keeps the raw materials in the cycle. This model also offers an opportunity for companies to invest in more durable, high-quality garments, which are more environmental-friendly."
61,product-as-a-service (PaaS),"PaaS model promotes sustainable manufacturing and consumption by offering long-lasting, repairable, and recyclable products.",0.7000000000000001,0.2,0.5,"['RPO', 'PLE', 'DFR']","Majority of cargo containers are abandoned post-usage, leading to extensive metal waste and environmental degradation, while urban areas face a shortage of parking spaces due to rapid urbanization.  ","We can leverage this situation by recycling and refurbishing these unused cargo containers to serve as portable garages. This would not only help to declutter the marine and dockyard spaces but also provide a sustainable, economic, and space-efficient solution for parking in congested urban areas. The containers can be refurbished with minimal energy input and subsequently leased out, creating a new revenue stream while contributing positively to the environment. This approach aligns with the circular economyâs principles of sharing, leasing and recycling."
62,Refurbished Electronics,Selling refurbished electronics to promote sustainability.,0.5,0.30000000000000004,0.75,['PLE'],"Firstly, it addresses the issue of resource depletion by promoting the use of products over ownership, which leads to a reduction in the amount of raw materials used. Secondly, it reduces waste by ensuring that products are designed for long-lasting use, repairability, and recyclability, thus reducing the amount of waste generated at the end of the product's life.

Furthermore, PaaS model reduces the environmental impact associated with the manufacturing process of new products, as fewer new products will need to be manufactured, leading to a reduction in greenhouse gas emissions, energy use, and water consumption. Additionally, it encourages manufacturers to take responsibility for the products they produce, leading to more sustainable and ethical practices.","product-as-a-service (PaaS) business model, where customers do not purchase products outright, but rather pay for the use of the product over a defined period. This would encourage manufacturers to design products with longer lifetimes and would incentivize them to make sure that the products are repairable and easily recyclable.

Under this model, manufacturers would retain ownership of the product and be responsible for maintenance, repair, and eventual end-of-life disposal. This would promote a circular approach to manufacturing, as the manufacturer would be motivated to ensure that the product has a long lifespan and is designed for easy disassembly and recycling."
63,eco filters,Eco filters for exhaust pipes to reduce smog and health issues.,0.7000000000000001,0.65,0.7000000000000001,"['DFR', 'PARTNERSHIP']",Refurbished Electronics,Refurbished Electronics to Make Circular Economy
64,new clothing items,"Re-Fab Fashion decentralized recycling unit transforms textile waste into new clothing, saving water and reducing pollution.",0.6000000000000001,0.30000000000000004,0.65,"['DFR', 'PARTNERSHIP']","Smog can cause shortness of breath, difficulty and cessation of breathing, insomnia, headaches, cough. It also causes inflammation of the mucous membranes of the eyes, nose and larynx, and a decrease in immunity. Smog often increases the number of hospitalizations, relapses and deaths from respiratory and cardiac diseases.","put eco filters on the exhaust pipes from which the country or city is heated, which will absorb most of the polluted smoke, as a result of which the amount of smog will be minimized and the further there will be fewer diseases due to lung disease"
65,recycling centers,Local recycling centers create jobs and promote a sustainable circular economy.,0.4,0.2,0.65,"['DFR', 'PARTNERSHIP']","Every year, the fashion industry produces billions of tons of waste due to the mass production model of fast fashion, contributing to landfill and pollution. This waste is usually incinerated or dumped into landfills, and currently less than 20% of it is recycled. The industry also uses a huge amount of water during production; it is estimated that it takes about 5,000 gallons of water to manufacture one T-shirt and a pair of jeans.  ","  We propose a solution in the form of a decentralized textile recycling and manufacturing unit, named """"Re-Fab Fashion"""". This innovative approach takes in discarded garments, separates the fibers and remanufactures them into new clothing items. The recycling process includes an environmentally-friendly method that involves minimal use of water and chemicals.  The unit will work in partnership with local fashion retailers and the community. Retail outlets can divert unsold clothing and fabric waste to the Re-Fab units. Consumers can also contribute by dropping off their old clothes. These collaborative efforts provide a strong business model for the unit, where the value of the recycled product can be significantly higher compared to the cost of raw materials and the recycling process.   Not only is this solution potentially profitable, but it also greatly lessens the environmental impact of the fashion industry by significantly reducing waste, water use, and carbon emissions associated with traditional textile manufacturing. Moreover, the decentralization of these âRe-Fabâ units makes this an easily scalable model. Each city or region could have their own local unit, hence drastically reducing the carbon emissions associated with transporting raw material and final products. This proposal, if implemented, has the potential to revolutionize the way our clothes are produced, consumed, and disposed of, bringing significant sustainability benefits to our planet."
66,Clothes as a Service (CaaS),Rent designer outfits through 'Clothes as a Service' to reduce waste and promote sustainable fashion.,0.7000000000000001,0.25,0.55,"['RPO', 'PARTNERSHIP']","The current rate of unemployment and underemployment is high in many communities, along with the growing issue of waste management and depletion of natural resources due to a linear economy.  ","Engage the principle of a circular economy in the waste management sector. Establish recycling centers that not just deal with waste in a sustainable manner, but also provide job opportunities to local communities. This approach can have a twofold benefit, it helps in solving our increasing waste management problems through recycling, reducing the drain on our natural resources, and it creates a new avenue for job creation, thus boosting the local economy. For example, a local recycling center that hires unemployed locals to sort recyclable materials, while also educating the community about the importance and techniques of recycling, embracing the sustainable model of a circular economy."
67,Packaging as a Service,Transitioning to reusable 'Packaging as a Service' model to reduce plastic waste and pollution.,0.7000000000000001,0.2,0.35000000000000003,['RPO'],"The apparel and fashion industry is one of the biggest polluters and contributors to climate change in today's economy. The majority of clothes are made unsustainably and have a short lifespan in the wardrobe of consumers before they are disposed of. This problem is exacerbated by the fast fashion trend, where new clothing collections are released every week, leading to a huge amount of clothes being manufactured and later disposed of, choking our planet.  ","In response to this problem, we propose an innovative business model called 'Clothes as a Service' (CaaS). CaaS works on the principle of leasing instead of owning. People rent clothes for a certain period of time and return them once they are done. Imagine getting your favourite designer dress or suave suit for that special event without having to worry about the high purchase costs or it collecting dust in your closet afterwards!  The first component of this logistics-heavy model would be meticulous cleaning and maintenance facilities. The clothes would have to be thoroughly cleaned after each user afin to maintain hygiene and quality.  Secondly, there would be a tailored subscription system, diversified based on customer needs: frequency of wardrobe change, style preference, occasion. This provides customers with variety and affordability, reduces over-consumption, and ensure clothes have a longer lifespan.   Thirdly, data analytics could be employed to forecast fashion trends, understand user patterns, and maintain optimum inventory. AI and machine learning could also be used to provide style tips or suggest apparel to users, thereby enhancing the customer experience while leveraging technology for operational efficiency.  Fourthly, at the end of the lifecycle of the clothes, the materials from the worn-out clothes could be recycled to manufacture new clothes, reducing the demand for virgin raw materials. A partnership could be forged with textile recycling companies to ensure efficient recycling of the end-of-life garments.  Lastly, consumer education and engagement campaigns could help bust myths around second-hand clothes and promote responsible consumption. This new scenario would help to significantly decrease clothing waste, reduce the industry's carbon water footprints, and open new business revenue streams. With the right blend of technology, logistics, partnerships, and consumer engagement, Clothes as a Service could be the next big step in the fashion industry's journey towards a sustainable future."
68,"clean water, energy and fertilizer","Nature-based wastewater treatment producing clean water, energy, and fertilizer.",0.7000000000000001,0.25,0.65,"['PARTNERSHIP', 'DFR']","The excessive production, use, and disposal of single-use plastic packaging is leading to devastating environmental pollution and resource depletion.  ","To resolve this issue, my proposal empowers and incentivizes companies to transition from single-use plastic packaging to a âPackaging as a Serviceâ model.   This radical solution veers from traditional product ownership towards utilizing packaging that companies retain ownership of and collect after use, repair, clean, and reuse. This reduces waste and the demand for new packaging production, leading to reduced resource depletion and pollution.   The company can harness advancements in tracking technologies (like RFID and IoT) to ensure efficient return and reuse of packaging. Customers can be incentivized through discounts or loyalty points for returning packages. This model is both feasible and scalable given the existing technology and infrastructure for collection and cleaning.   This solution will not only significantly decrease environmental impact but could also lead to substantial cost savings for businesses in the longer term as they save on costs of purchasing new packaging. Further, it could create a new revenue stream, monetizing this service for other companies as well. Thus, the financial impact of this solution is twofold: cost reduction and revenue generation."
69,uniquely designed products made of upcycled material,Integration of upcycling in product design for sustainable business revenue.,0.7000000000000001,0.30000000000000004,0.65,"['DFR', 'PARTNERSHIP']",Urban Wastewater generated in cities. Wastewater in developing countries are hardly managed. They end polluting surface and underground water. This is dangerous to public health.,"Circular Urban Wastewater management. A nature based solution where we combine the process of anaerobic digestion and algae oxidation to produce clean water, energy and fertilizer. "
