id,product,summary,embedded_value,access_level,processing_level,categories,problem,solution
138,upcycled furniture,Upcycling used car tires into sustainable furniture.,0.5,0.25,0.55,"['DFR', 'PARTNERSHIP']","To make the clothing industry more sustainable and less wasteful while also generating consistent revenue, the traditional make-use-dispose approach needs a massive shift.  ","A 'Shared Wardrobe' concept provides a more innovative, environmentally friendly, profitable, and scalable solution. This model builds upon the initial 'Rent and Return' model but introduces community-centered sharing. It involves creating community hubs or shared wardrobe centers where individuals can donate, borrow, or swap clothes.   The shared wardrobe model is different from existing sharing platforms, as it brings the concept of 'community' back into fashion, encouraging local sharing and exchange and fostering a sense of unity and mutual respect for resources. It reduces the demand for new clothes, cutting down on waste and conserving resources.   From a financial perspective, businesses can profit from managing these hubs and offering premium services such as home delivery, personalized styling, or premium wardrobe access. By targeting communities instead of individuals, the model establishes a wider potential customer base, making it more profitable.  Considering the feasibility and scalability, this model requires fewer resources for initial setup as it relies significantly on community-generated inventory. Consumer concern about hygiene can be addressed by integrating professional cleaning services. Furthermore, this model can be easily replicated in any community, increasing scalability. Its success depends on a shift in consumer mindset, fostered by the increasing trend towards sustainability. It represents a future where fashion retail is not just about business but also about community and sustainability."
139,cleaning agent,Transforming leftover restaurant soda into eco-friendly cleaning agents to reduce waste and costs.,0.30000000000000004,0.2,0.2,['DFR'],Rapid deforestation caused by the furniture industry is contributing to climate change and reducing the availability of agricultural land.,"Implement a business model where used car tires are recycled and upcycled into quality furniture items such as chairs and tables. This solution not only enables businesses to source materials more sustainably but also creates a new market for upcycled products. Existing tire recycling facilities can be harnessed for this process, making it financially viable and relatively easy to implement on a large scale. Potential financial benefits include cost savings from sourcing cheaper materials (tires) and revenue from selling upcycled products. Furthermore, businesses can explore potential collaborations with tire manufacturers, automobile repair shops, and waste management companies to ensure a steady supply of used tires. This comprehensive approach to recycling is a creative take on the circular economy, potentially reducing environmental impact and increasing profits."
140,toilet brushes,Transforming discarded plastic bottles into eco-friendly toilet brushes to reduce pollution and carbon footprint.,0.2,0.2,0.45,"['DFR', 'PARTNERSHIP']","Global restaurants generate an enormous amount of beverage waste, particularly soda, which typically ends up in landfills or in our oceans, contributing to pollution and landfill growth.   ","My idea involves repurposing leftover soda in restaurants as a cleaning agent. This could minimize waste, turn a cost (waste disposal) into a resource (cleaning product), reducing the restaurants' expenditure on cleaning products. Using soda as a cleaning agent also has the advantage of being biodegradable, non-toxic, and environmental-friendly, compared to conventional cleaning products. This could be achieved by comprehensive staff training and the implementation of clearly outlined procedures for the collection and usage of leftover soda. Furthermore, additional research could be conducted to maximize the use of soda in different cleaning scenarios within the restaurant setting."
141,targeted and well paced training program,"Freelance year-long, part-time IT training program for potential hires to improve hiring accuracy and reduce turnover.",0.4,0.1,0.1,['PARTNERSHIP'],"The relentless production and disposal of plastic bottles are creating serious environmental pollution problems worldwide. Waters, lands and air are constantly besieged by these non-degradable pollutants, causing harm not just to human health but endangering our wildlife and marine organisms. Furthermore, producing these plastic bottles introduces a substantial volume of greenhouse gases, signifying a significant contributor to climate change.  ","A unique and promising approach to combat this is by transforming discarded plastic bottles into toilet brushes, redirecting the waste from our environment back into productive use. This not only drastically reduces waste and carbon footprint, but it also encourages businesses to profit from plastic recycling. This model is easily scalable and can be adopted by businesses worldwide, stimulate economies while helping to protect our planet. So let's put that plastic waste to work and keep our earth clean, one toilet brush at a time!"
142,tech-focused circular economy platform,"Tech-focused circular economy platform to reduce e-waste through recycling, refurbishment, and education.",0.7000000000000001,0.4,0.85,"['DFR', 'PLE', 'PARTNERSHIP']",Every year there is a mass hiring and then firing  (those found ineligible after training & evaluation) of IT employees especially freshers/interns by leading Software Companies. The cost of training along with salary given is a huge loss of revenue for the organization in those who are terminated. Also it is traumatic for the terminated employee at so many levels.,"Premise -> Being a certified trainer, I am hired as a freelance to conduct software training for organizations mostly for their newly recruited trainees from across the campus placements. These trainings are for upto 3-4 months with 8-9 hrs per day. However considering the no of topics that need to be touched and size of batches (upto 100 per batch) , these end up being more like a crash course. The mode is online(Zoom class) or offline at client's location. After the training trainees are evaluated and then decided if they will continue or be terminated. During the entire training, employees enjoy all benefits including salary & perks. Also many employees leave half way as they don't find the work profile matching to their assumptions/expectations as most of them were just students when hired.

My_Solution-> The campus interviews should be conducted in the second last year instead of last year of graduation and tentative/potential candidates can be identified. For the prospectives, an online/offline training of 1-2 hrs per day or 3 days a week can be conducted for the desired topics for the entire last year absolutely free. The time duration for a day can be minimal to not clash with other college activities. During the entire training for 1 year, both the trainee and the organization can evaluate each other vis--vis job expectation (for employee) versus trainee's potential(for organization). On successful match on both sides, offer can be made by the organisation for joining. For the other (non selected) trainees, they gain a standadized training at no cost which might be useful for them. Also Organization may or may not provide a token stipend for trainees as they are providing a no clause training without any cost to student.

Conculsion -> A targeted and well paced training will solve the organization need for right talent instead of mass hiring and hoping to meet the target under a given percentage of initial count / final count. The cost of trainer for an year (with 1- 2 hours per day freelance) will be much lesser than paying a whole bunch of trainees for months and releasing them later. 
The evaluation of candidate's profile will be much more accurate compared to analysis of within few hours of recruitment conducted on placement day.

This will also confirm the trainee about the job expectation and whether they should pursue a career in the field and escape disappointments later."
143,Circular Closet digital platform,"Digital platform for sustainable fashion via sharing, swapping, leasing, and recirculation.",0.7000000000000001,0.2,0.1,"['RPO', 'PLE', 'PARTNERSHIP']","The technology market sees fast-paced innovation, leading to an increased rate of electronic waste. Electronic or 'e-waste' includes devices such as cellphones, computers, and tablets, which are being discarded at an alarmingly high frequency. These devices contain precious metals and finite resources that could be repurposed or recycled, presenting a significant loss in potential resource value.  ","The primary solution to this 'e-waste' problem is the formation of a tech-focused circular economy platform, primarily focused on the 'Reduce, Reuse, and Recycle' philosophy. The platform would function by encouraging users and businesses to give their unwanted electronics for recycling or refurbishment within the community. Apart from reducing e-waste, this would also provide an inexpensive solution for those who need technology but can't afford new devices.   Secondly, this platform can collaborate with tech companies to provide incentives or discounts to those who return old devices to the company when purchasing new ones. This would motivate the purchase of new electronics to be more deliberate and would feed into the recycling/reusing processes employed by tech companies.  Lastly, the platform would differentiate itself with an educational focus. It would launch learning resources and workshops for users to understand the need for a circular economy, and how they can maintain and repair their devices independently. This promotes the longevity of electronic devices, thereby reducing the rapid turnover that contributes to e-waste. Together, these steps will foster a sustainable, top-to-bottom approach for managing technology lifecycle within a circular economy."
145,Circular Fashion Model,"Circular fashion model promoting rental, durable design, repair services, and take-back programs to reduce waste.",0.55,0.35000000000000003,0.55,"['RPO', 'PLE', 'DFR']","The fashion industry contributes massively to environmental degradation through waste generation, water pollution, the use of toxic chemicals, and high carbon emissions. Fast fashion trends exacerbate this problem, leading to a surplus of clothes being manufactured, purchased, and quickly discarded, creating tons of garment waste that often ends up in landfills.  ","The proposed concept is the """"Circular Closet"""" - a digital platform that encourages and facilitates clothes sharing, swapping, leasing, mending, upcycling, and recycling. This platform would connect consumers, fashion brands, local artisans, and recycling facilities to extend the life cycle of clothes and minimize waste from the fashion industry.  In this model, fashion brands would provide detailed information about the materials used, manufacturing processes, recyclability, and potential upcycling ideas for all garments. Consumers could rent or swap clothes through the platform, reducing the need for new clothes production. Local artisans could offer services for mending or upcycling clothes, adding value to older garments and keeping them in use longer.  The platform could also guide customers on how to recycle their old, unusable clothes properly, thereby diverting these from landfills. This model not only reduces waste but also promotes sustainable consumption, supports local economy, enhances consumers' connectedness to their clothes and decreases the demand for new clothes production, in turn, reducing the environmental footprint of the fashion industry.  Moreover, the platform could influence fashion brands to design clothes with longer lifecycles and recyclability in mind. It could also provide financial incentives to consumers and fashion brands for engaging in such sustainable practices.  While the idea has an element of novelty, it is feasible as it leverages technology for the creation and management of the digital platform. Its scalability is wide, addressing a global problem and being able to cater to a global market. It has a great environmental impact potential by significantly reducing fashion waste and carbon emissions, and encouraging sustainable consumption and production. Financially, it offers the potential for revenue generation through platform fees, services, and partnerships. "
146,eco-reflective cool paint,Cool paint technology reduces A/C use and greenhouse gas emissions.,0.6000000000000001,0.2,0.30000000000000004,['PLE'],"The traditional linear economy, where resources are extracted, used, and discarded as waste, is becoming increasingly unsustainable due to overconsumption, waste generation, and depletion of resources. This leads to a range of environmental and social problems such as climate change, resource depletion, and waste pollution.","Solution to these problems, aimed at reducing waste, conserving resources, and creating sustainable economic growth. In the circular economy, resources are kept in use for as long as possible and waste is reduced through closed-loop systems of production, consumption, and recovery.

One of the key solutions of the circular economy is the promotion of product design that is focused on closed-loop life cycles. This means that products are designed to be easily recovered and recycled, reducing the amount of waste sent to landfill. The use of sustainable materials, such as biodegradable plastics, can also help to reduce waste and conserve resources.

Another important aspect of the circular economy is resource conservation. The circular economy model aims to maximize the use of existing resources, reducing the need for new resources to be extracted, processed, and manufactured into new products. This can be achieved through increased efficiency in production and consumption, as well as the promotion of product-as-a-service models, where the focus is on delivering a service rather than selling a product. This shift in focus encourages the use of products for longer periods and reduces waste generation.

Waste reduction is another key solution offered by the circular economy. By designing closed-loop systems of production, consumption, and recovery, waste can be reduced by keeping materials in use for as long as possible. This includes the reuse and recycling of materials, as well as the recovery of valuable resources from waste. For example, the circular economy promotes the use of composting and anaerobic digestion to recover energy and resources from organic waste.

Finally, the circular economy offers economic benefits. By adopting this model, we can create new economic opportunities and drive sustainable growth, as it encourages innovation and the development of new products, services, and business models. This, in turn, can create jobs and boost economic growth, while reducing waste and conserving resources.

In conclusion, the circular economy offers a sustainable and holistic approach to economic development, where the environment and social considerations are integrated into the decision-making process. By adopting this model, we can create a more sustainable future, where resources are conserved, waste is reduced, and economic growth is driven in a responsible and sustainable manner.



Check out my own research on this topic, it includes all about CIRCULAR ECONOMY. I have uploaded it in [""""Are there any resources, such as files, research etc. that you can share to help users understand this solution more in depth?""""] section  name 
Untitled document.docx"
147,recycled plastic construction materials,Recycling plastic waste into construction materials to reduce pollution and provide cost-effective alternatives.,0.5,0.35000000000000003,0.75,['DFR'],The exponential growth in the fashion industry and fast fashion trends contribute to excessive textile waste and environmental pollution.,"Implement a 'Circular Fashion Model' that encapsulates the following:  1. Clothing Rental Services: Just like the 'Electronics as a Service' model, fashion brands can offer their clothes on a rental basis, specifically for occasional wear, which is used very infrequently. This reduces the requirement to produce excessive clothing, in turn, preserving resources and minimizing waste.  2. Design for Durability and Recyclability: Fashion brands should focus on designing durable clothing with recyclable materials. This ensures clothes last longer and eventually can be recycled into new clothing items, significantly cutting down textile waste.  3. Repair and Redesign Services: Brands can provide services to repair worn-out clothing or redesign outdated fashion pieces, extending their lifespan and reducing the need to purchase new items.  4. Take-Back Programs: Brands building programs where consumers can return their used garments in exchange for incentives. These returned clothes can either be recycled or resold in the second-hand market, thus closing the loop.  This model brings about considerable environmental benefits by reducing textile waste and resource consumption. Financially, clothing rental and redesign services can be new revenue streams for brands. The success and scalability of this plan depend on consumer acceptance for rental and second-hand clothes, brands investing in durable and recyclable designs, and efficient recycling systems. However, given the increasing awareness and demand for sustainable options among consumers, this is a feasible and scalable strategy for the fashion industry."
148,Fashion Library,"Fashion Library: Renting clothes, reducing waste and industry resource usage.",0.55,0.30000000000000004,0.2,"['RPO', 'PARTNERSHIP']","The urban growth and increasing global temperatures have significantly driven up the usage of air conditioning systems. This excessive energy consumption contributes to an upsurge in greenhouse gas emissions, further escalating the threats posed by climate change.  ","Utilizing eco-reflective cool paint technologies, such as those based on titanium dioxide, can be a groundbreaking solution. This nanotechnology-based paint is capable of reflecting sunlight and emitting absorbed heat, thereby reducing heat absorption and the dependency on air conditioning. The propensity of these paints to substantially decrease energy consumption presents appealing cost-saving potential for businesses, especially those in the building and construction industry. Moreover, this solution's feasibility is already evidenced by existing studies and implementations, with scalability potential in various climates and urban settings globally. With a clear environmental mitigation effect through lowered emissions and significant financial value creation, adopting such cool paint technologies represents a stride towards a circular economy."
149,The Wind Tree,Urban-friendly Wind Tree turbines for low-speed wind energy generation,0.7000000000000001,0.35000000000000003,0.65,"['DFR', 'PLE']","Mass plastic pollution is a serious environmental hazard contributing to the alarming accumulation of approximately 5.25 trillion individual plastic particles, weighing around 244,000 metric tons, in our oceans annually. The widespread production and poor disposal of plastic waste coupled with its environmental persistence has become a primary concern, affecting marine biodiversity and indirectly human health.  ","An innovative approach to mitigate this issue is recycling plastic waste through a chemical treatment process to produce durable construction materials, such as solid sidewalk bricks and artificial grass for sports fields. By undergoing high-temperature processing, these recycled plastics become resilient enough to withstand human traffic and weather conditions. This solution serves a dual purpose: it helps clear up plastic waste from the environment and provides a cost-effective alternative to traditional, highly polluting building materials like cement. The end product can be instrumental in the infrastructure and sporting developments, particularly in regions like Africa, where access to quality, affordable construction materials is limited. The financial impact will be significant and beneficial to businesses and communities alike, while reducing ecological harm. Challenges to be faced include managing potential high upfront costs and ensuring widespread acceptance of recycled plastic as viable construction material."
150,Circular Series jackets,"Single polymer jackets from Napapijri, recyclable, incentivizing returns with discounts, aiming for circular economy.",0.7000000000000001,0.30000000000000004,0.2,"['DFR', 'RPO']","The fashion industry, one of the largest industrial sectors, produces a vast amount of waste material each year. These waste materials usually end up in landfills contributing to environmental pollution. The desire for fast, disposable fashion also implies a large consumption of water and energy resources.   ","The innovative concept of a 'Fashion Library' is a promising solution to this issue. A fashion library allows customers to rent clothes for a fraction of their retail price, using them for a designated period of time before returning them for others to use. This reduces the demand for new clothes manufacturing, thus cutting down on industrial waste. It also gives a second, third, or fourth life to garments reducing their lifecycle impact on the environment.   To make this concept financially viable, customers could pay a monthly subscription fee, much like a gym membership. They can borrow clothes as often as they want, keeping them for as long as they wish before returning. This not only saves customers money but can also help businesses generate continuous revenue.  Implementation of such a model on a larger scale would require collaborations with fashion brands, logistics management for delivery and return, and the use of technology for customer interface and inventory management. The model could start with higher-end clothes as they are more durable and then expand down the line. Over time, as more consumers join the network, the savings in terms of resources, emissions, and waste could be substantial, making this idea scalable and aligning with the principles of the circular economy. "
151,digital publishing platform,Digital platform for eco-friendly digital book publishing and emergent writer exposure with a freemium model.,0.7000000000000001,0.05,0.1,"['DFR', 'RPO']","The installation of traditional wind turbines requires significant amounts of money, energy, and space, which can be a challenge, particularly in densely populated areas such as cities. While wind turbines and solar panels are often installed in remote areas, it is not always feasible to install these massive structures in the downtown areas of a city. This challenge has made it difficult to harness renewable energy sources in urban areas and to reduce dependence on non-renewable sources of energy.
","The Wind Tree, developed by New World Wind, is an innovative vertical-axis wind turbine designed to generate electricity from wind energy in urban and suburban areas. Its unique design, resembling a tree with three steel trunks and smaller branches housing miniature wind turbines shaped like leaves, allows it to blend in with its surroundings while providing an environmentally friendly form of energy. Unlike traditional horizontal-axis wind turbines that may not be suitable for urban areas due to their large size and noise levels, the Wind Tree is specifically designed to be efficient at low wind speeds that are common in cities.

The Wind Tree requires only an 11-meter radius of land to be installed, making it ideal for installation in parks, business plazas, and even homes. Additionally, New World Wind created the Aeroleaf, the first micro-turbine that can catch wind energy at 360¡ and only requires a wind speed of 2.5 meters per second to initiate energy generation. This feature makes the Aeroleaf highly efficient at generating electricity in urban and suburban areas with low wind speeds.
"
