id,product,summary,embedded_value,access_level,processing_level,categories,problem,solution
1,Modular Construction,"Modular construction reduces waste and saves time, promoting recycling and reuse in the construction industry.",0.7000000000000001,0.7000000000000001,0.65,"['DFR', 'PLE']","The construction industry is indubitably one of the significant contributors to global waste, contributing approximately 1.3 billion tons of waste annually, exerting significant pressure on our landfills and natural resources. Traditional construction methods entail single-use designs that require frequent demolitions, leading to resource depletion and wastage.   ","Herein, we propose an innovative approach to mitigate this problem: Modular Construction. This method embraces recycling and reuse, taking a significant stride towards a circular economy.   Modular construction involves utilizing engineered components in a manufacturing facility that are later assembled on-site. These components are designed for easy disassembling, enabling them to be reused in diverse projects, thus significantly reducing waste and conserving resources.  Not only does this method decrease construction waste by up to 90%, but it also decreases construction time by 30-50%, optimizing both environmental and financial efficiency. This reduction in time corresponds to substantial financial savings for businesses. Moreover, the modular approach allows greater flexibility, adapting to changing needs over time.  We believe, by adopting modular construction, the industry can transit from a 'take, make and dispose' model to a more sustainable 'reduce, reuse, and recycle' model, driving the industry towards a more circular and sustainable future. The feasibility of this concept is already being proven in markets around the globe, indicating its potential for scalability and real-world application."
2,wind power generation technology,"Revolutionary commercial-scale wind energy generation without large windmills, promising a clean and quiet future.",0.8,0.85,0.65,['PARTNERSHIP'],"I'm sure you, like me, are feeling the heat - literally! With World Health Organization declaring climate change as """"the greatest threat to global health in the 21st century"""", we're in a race against time to move away from fossil fuels to more efficient, less polluting electrical power. But as we take bold leaps into a green future with electric cars and heating, we're confronted with a new puzzle - generating enough electrical power without using fossil fuels!  ","Imagine standing on a green hill, not a single towering, noisy windmill in sight, and yet, you're surrounded by wind power generation! Using existing, yet under-utilized technology, I propose a revolutionary approach to harness wind energy on a commercial scale, without those """"monstrously large and environmentally damaging windmills"""". With my idea, we could start construction tomorrow and give our electrical grid the jolt it needs, creating a future where clean, quiet and efficient energy isn't a dream, but a reality we live in. This is not about every home being a power station, but about businesses driving a green revolution from the ground up!"
3,Book Swap program,Book Swap program to trade and incentivize reusing textbooks.,0.2,0.2,0.1,"['RPO', 'PARTNERSHIP']","The massive shift in student learning towards digital platforms has resulted in an increased carbon footprint due to energy consumption from data centers and e-waste from obsolete devices. Simultaneously, physical books are often produced, used once, and then discarded, leading to waste and deforestation.  ","Implement a """"Book Swap"""" program within educational institutions and local communities. This platform allows students to trade books they no longer need with others who require them, reducing the need for new book production and hence, lowering the rate of resource depletion. Furthermore, the platform could have a digital component to track book exchanges, giving users credits for each trade, which they can accrue and redeem. This system encourages and amplifies the benefits of reusing and sharing resources, thus contributing to the circular economy.   By integrating gamification, getting students and parents involved and providing an easy-to-use platform, the program could influence a cultural shift towards greater resource value appreciation and waste reduction. In terms of the financial aspect, less reliance on purchasing new books could save money for students, parents and schools."
4,garment rental service,"Garment rental service to reduce fashion industry pollution and waste, with a subscription, reuse, and recycling model.",0.5,0.30000000000000004,0.2,"['RPO', 'PLE']","The fashion industry is one of the top contributors to global pollution. The mass production, distribution and disposal of clothing is not sustainable long-term, leading to the release of greenhouse gases from manufacturing, shipping and wasted clothing in landfills.   ","The proposed solution is a garment rental service. Such a service should work closely with major clothing brands. When buying items, customers should have the option to buy or rent. This model would be like a subscription service where customers can select a set number of items each month, wear them, then return them for other items. Clothing would be professionally cleaned between customers and repaired as necessary to maximize its life cycle. When a garment is no longer suitable for rental, it can be recycled into new clothes. This solution reduces the number of garments produced, the amount of transportation needed, and the quantity of clothes going to landfills. Completely damaged or unusable textiles can be reused or recycled into new products. It also gives financial value to businesses as it transforms fashion from a single-purchase model into a subscription service, creating a continuous income stream. Its feasibility and scalability depend on factors such as location, culture, and income level. However, as digital platforms become more common for commerce, this concept could be globally implemented."
5,modular electronic device,Modular electronic devices enabling component upgrade or replacement to reduce e-waste and enhance resource efficiency.,0.7000000000000001,0.35000000000000003,0.75,"['PLE', 'RPO', 'DFR']","The majority of the materials used in producing electronic goods are not being utilized optimally. Numerous electronic devices are replaced before their lifespan ends, often due to minor malfunctioning or outdated components, resulting in significant production of electronic waste and underutilization of natural resources.  ","An innovative concept would be a modular electronic device model where users are able to upgrade or swap components, rather than replacing the entire device, thus promoting a circular economy. This goes beyond just restoration but rather the idea of creating an electronic gadget that thrives on reuse and modifications, maximising the life and value of each part.   Manufacturers need to design gadgets with modules for core components, allowing for easy upgrades or replacements. For instance, a smartphone could have individually upgradeable components: camera, battery, CPU, etc. When a module fails or becomes outdated, only that module needs to be replaced.  This idea promotes resource use efficiency and significantly cuts waste, under the 'reduce, reuse, repair' mantra. The replaced modules should be sent back to manufacturers for refurbishment or extraction of critical raw materials.   For businesses it opens a new market space, enabled by sale of modules and recycled components, providing long term value capture. It also increases customer loyalty as they continually engage with the manufacturers in the lifecycle of their device. The model is scalable as it allows for the continuous incorporation of technological advancements within the same core device.   This modular approach is not only novel but it clearly addresses the broader picture of how electronic devices should be designed for a circular economy, considering environmental protection, resource efficiency, economic viability, and customer value."
6,secure mobile app,Mobile app for digital receipts reduces paper waste and operational costs.,0.7000000000000001,0.1,0.05,['DFR'],Businesses worldwide expend substantial financial resources on paper-based transaction evidence like printed receipts. This not only adds to operational costs but also contributes to environmental degradation due to paper wastage and lack of recycling.,"The proposed solution involves developing a secure mobile app that digitizes the process of storing transactional evidence. In lieu of printed receipts, the app records and stores all customer purchase data. A 'tap-and-go' feature would facilitate smooth transactions.   Environmental Impact: This reduces paper consumption significantly, thereby promoting resource conservation and lowering the waste generated every year due to discarded receipts.  Financial Impact: Businesses stand to make substantial savings on paper, printing, and storage costs over time. Given the trend of digital technology adoption, offering digital receipts can also enhance customer experience leading to potential increased patronage.  Feasibility and Scalability: With the rise of digital technology acceptance, implementation of this solution is feasible. Businesses of all sizes, from local shops to multinational chains, can adopt this system, thus indicating high scalability. Increasing smartphone penetration offers an existing infrastructure that can host this solution, reducing the barriers to entry and adoption.   The focus will remain on the environmental and financial benefits of this proposed solution, although additional """"quality of life"""" features may be developed over time to increase user engagement and usage."
7,Recycled plastic,Bariq factory recycles Egypt's plastic bottle waste,0.30000000000000004,0.2,0.65,['DFR'],more than 130 Billon plastic bottles waste annualy in Egypt,Bariq factory to recyle plastic bottels
8,"Handover Radar, AI-based Forecasts, Ride-sharing Radar",Revolutionary carsharing with AI forecasting and real-time user connectivity for easier handovers and parking.,0.7000000000000001,0.2,0.05,['PARTNERSHIP'],"In congested cities like Berlin, one of the significant challenges faced by carsharing users is the difficulty in finding a parking spot and handing over the vehicle, resulting in extended driving distances, increased costs, frustration, and augmented fuel consumption.  "," Let's revolutionize the carsharing experience with our creative solution! Implementing a three-part strategy consisting of a """"Handover Radar"""", """"AI-based Forecasts"""", and """"Ride-sharing Radar"""".  1. The """"Handover Radar"""" - think of it as GPS for people! It connects drivers to potential renters in their destination area, eliminating the need to search for parking.  2. """"AI-based Forecasts"""" - Our crystal-ball for car availability! Using past patterns and real-time data, it predicts car availabilities for renters, increasing overall efficiency majorly.  3. """"Ride-sharing Radar"""" - Your carpooling maestro! It connects drivers and passengers heading the same way, reducing costs while providing a convenient option for pedestrian commuters.  Get ready to enjoy a seamless carsharing experience, save money, reduce frustration, and, most importantly, contribute to our planet's health! Let's drive towards a greener future together!"
9,Reusable containers,Innovative 'Packaging as a Service' model to reduce plastic waste by utilizing reusable containers.,0.5,0.30000000000000004,0.30000000000000004,"['RPO', 'PLE']","One major global issue we face today is the surplus of plastic waste. Single-use plastics are commonly used for packaging in various sectors, like retail, food, and manufacturing. These plastics, often non-recyclable or ignored during waste management, clog up our oceans, harm wildlife, and end up in landfills, where they take hundreds of years to degrade. Furthermore, producing these plastics requires a significant amount of energy and resources and contributes to environmental degradation.  ","My solution is an innovative Reloop - System, which involves a comprehensive 'Packaging as a Service' model for businesses across sectors.   In the first step, productions and businesses would eliminate their need for newly produced plastic packaging whenever possible, by collaborating with a 'Packaging as a Service' provider. Each business would regularly receive high-quality, standardized, reusable containers from the service. They fill these containers with their products, and after distribution, the used containers are rounded up from retail stores or directly from consumers.  The second step involves the cleaning and sanitation process. Gathered containers are mechanically cleaned and sterilized, making them ready for reuse. As these containers are durable and designed for multiple uses, this process significantly reduces the demand for single-use plastics.  Lastly, the circular nature of this model ensures massively reduced plastic waste production and encompasses a viable financial model. Businesses save money by reducing expenditure on plastic packaging production or procurement. The service creates new job opportunities in the collection, cleaning, and redistribution of containers, contributing to the economy. While this idea may face implementation challenges due to existing infrastructures and systems, its long-term benefits and scalability make it a feasible solution to the current plastic waste problem."
10,reusable bottles,Refillable bottle service for beverages,0.30000000000000004,0.2,0.2,"['PLE', 'RPO']",The usage of plastic bottles,"Creating a service that sells bottles, and re-fill them with soda, water, juice or anything you want. This service will have stores and whenever you want to fill your bottle you can go there  insted of buying a new bottle of water or soda or anything."
11,Smart Packaging as a Service,"Innovative 'Smart Packaging as a Service' with IoT for optimal logistics, enhanced customer experience, and eco-friendliness.",0.75,0.25,0.65,"['RPO', 'PLE']","Despite the environmental principles behind a reusable packaging service model, in its current form, it demands significant adjustments from businesses, requires customer cooperation, may induce additional costs, and presents operational risks. Additionally, while the concept supports the circular economy, it lacks novelty.  ","To resolve these constraints and amplify the novelty factor, we are proposing an innovative """"Smart Packaging as a Service"""" model. The core of our idea revolves around developing intelligent, durable, and reusable packaging equipped with IoT (Internet of Things) sensors. These smart packages can provide real-time data about the package's location, state, and conditionâhelping businesses to streamline their logistics, reduce waste, and lessen the environmental impact, while also enhancing customer experience.  Novelty lies in how we transcend the usual reusable packaging model by integrating IoT technology. The interactive platform associated with IoT would encourage customers to return the packages by providing benefits such as loyalty points, adding a gamification aspect. Furthermore, it can generate new revenue streams by leveraging the data gathered, enabling businesses to optimize their operations, reduce costs or even sell this data to interested third partiesâmaking the proposition not just cost-effective, but financially rewarding.   The nature of IoT allows for scalability with growth and feasibility in several industries from food delivery, retail to pharmaceuticals, and more. Environmental impact is felt not just through the direct reduction in singular use packaging, but also from the optimised logistics reducing additional carbon emissions. This Smart Packaging as a Service offers an evolved take on the traditional Packaging as a Service model, increasing the novelty and improving upon the financial and environmental impacts and feasibility."
12,Fashion Library,"Fashion library platform for borrowing clothes, reducing production, waste, and environmental impact.",0.55,0.2,0.30000000000000004,"['RPO', 'PLE']","The fashion industry is the second-largest polluter in the world, right after the oil industry. Every year, the world consumes about 80 billion new pieces of clothing, and this production consumes resources, raises the carbon footprint, and produces waste. The fast fashion cycle encourages this overconsumption model, causing tremendous stress on our planet's resources.   ","Our solution to this is to transform the way we consume fashion through the creation of a shared fashion platform â a fashion library. The fashion library will function on the concept of lending versus owning; it's like Airbnb but for clothes.   Customers become members and can borrow from a vast clothing collection for a duration of their choice, starting from day-long rentals for special occasions to month-long arrangements for regular wear. The clothes are then returned, cleaned, and made available again for the second round. This creates a constantly rotating wardrobe, reducing the need for production of new clothes, thus minimizing environmental footprint and wastage.  This library could contain pieces from a variety of sources including designer collaborations, garments from sustainable brands, donations from individuals, and more. It encourages the reuse and recycling of garments, immensely reducing the environmental impact caused by constant production.  From a financial perspective, this model can be lucrative for businesses as it provides access to a larger customer base; consumers who typically can't afford designer or high-quality sustainable clothing can now access these pieces at a fraction of the cost.   The feasibility and scalability of such a concept have already been proven with successful pilot projects in cities like New York and London. With increasing environmental consciousness among consumers, this model has the potential to disrupt and transform the fashion industry, making it more circular, sustainable, and inclusive."
13,Integrated Clothing Lifecycle Management system,"Hybrid fashion model combining rental, resale, and recycled clothing with local circular economy networks.",0.7000000000000001,0.25,0.30000000000000004,"['RPO', 'PLE', 'PARTNERSHIP']","The fashion industry has a considerable environmental impact due to high resource utilization and waste. However, implementing a """"pure"""" rental model may face several feasibility and scalability issues, and the environmental benefits may be offset by the footprint of maintenance and logistics.  ","Instead of a complete rental model, we propose an """"Integrated Clothing Lifecycle Management"""" system, where businesses not only rent out clothes but also sell second-hand clothes, create clothes from recycled fibers, and incentivize consumers to participate in these activities. In the proposed model, companies should collaborate with local businesses like laundromats and recyclers, turning every city into a practical network hub of the circular economy, which will reduce the carbon footprint of logistics. This model increases customer engagement and improves feasibility by offering options that falls in line with comfort for different market segments. It is scalable as it can be adapted by both big brands and local businesses, and it reduces the dependency on garment production and the associate environmental toll. It thus provides a financial prosperous scenario as well, by tapping into the burgeoning second-hand and sustainable market."
14,refurbished and recycled electronic components,Recycling and reusing e-waste components to reduce electronic waste and manufacturing costs.,0.45,0.55,0.75,"['DFR', 'PLE', 'PARTNERSHIP']",The solution is meant to solve the issue of electronic waste and reduce the heap of idle electronic products in our homes,"E waste has always been a growing problem in the world. The inclusion of circular economy techniques in our day to day life can bring about a huge change in this context. The consumer electronic goods that remains idle in our homes or is inoperative can be thought of as a means to implement the idea. If there exists a system which can collect the inoperative home consumer goods, extract the different parts like transistors, diodes, etc and make it to use in future products, I think it may reduce the problem of e waste marginally. Even if the parts are damaged, in some cases, trying to repair them can be much more cheap way than building a new component altogether. Thus even the manufacturing cost can be reduced. Also, there can be a quick supply of electronic components in the market. 
There can also be a responsible framework of second hand consumer electronic goods. Thus even the poor people can afford the best of consumer electronics without spending much from their pocket. This will include more people in the consumer electronics market which can in turn improve the market forces."
15,app,App for optimizing reusable packaging's reverse logistics to reduce single-use plastic waste.,0.55,0.25,0.1,"['RPO', 'PARTNERSHIP']","Single-use plastic packaging has become an all-too-common sight in our environment, resulting in detrimental environmental impacts. Studies show that approximately 8.3 billion tonnes of plastic have been produced since 1950, and 60% of that plastic ends up in either our landfills or the natural environment. This contributes greatly to pollution, harms wildlife, affects human health, and exacerbates climate change.   ","To alleviate this problem, we propose developing a consumer-friendly, easy-to-use app that manages and optimises the reverse logistics of packaging. Imagine this: when purchasing a product, consumers will pay a one-time fee for reusable packaging. After use, they can return the empty packaging via designated collection points or direct pickup services. The app will facilitate this process by tracking, scheduling pickups or locating nearby collection points. The packaging is then cleaned and reused, thereby reducing the need for new plastic production and ensuring the packaging circulates within the economy, instead of ending up as waste. This app will not only help consumers make more sustainable choices but also incentivise producers to shift towards a circular economy model."
16,upcycled apparel,"Revolutionary recycling of fast-fashion waste into upcycled local apparel, promoting sustainability and job creation.",0.45,0.25,0.4,"['DFR', 'PARTNERSHIP']","The fashion industry contributes about 10% of global CO2 emissions, with fast fashion being the major contributor. Fast fashion leads to the creation of end-of-life waste, where 85% of textile waste ends up in landfills or is incinerated. Furthermore, the industries involved in the production of fast-fashion are found in developing countries where workers face poor working conditions, and economies struggle due to rising waste management costs.  ","""""Full Turn Fashion"""" is a comprehensive circular economy model designed to tackle fashion waste and pollution. Ushering the paradigm shift from usual 'produce-use-dispose' to 'reduce-reuse-recycle, we encourage consumers to return their worn-out clothing which we will collect, sort and recycle into unique, locally produced garments. Wastes unsuitable for direct recycling will be decomposed to produce organic dyes and materials. Operating specifically within fast-fashion importing countries, these processes involve local SMEs and communities, promoting local economy growth and creating jobs. Financial feasibility is achieved through revenue from the sale of upcycled apparel and premium value added to Geographical Indication. Our model is scalable, with potential for network expansion across other fast-fashion importing countries, steering the global fashion industry towards sustainability."
17,online platform for leasing electronic devices,Online platform for leasing electronic devices to reduce e-waste.,0.7000000000000001,0.25,0.9,['RPO'],"Rapid advancement in technology and our demand for the latest electronic devices, such as laptops, computers, and other digital gadgets, result in huge amounts of electronic waste. It's not just harmful for the environment but also poses potential health risks due to the toxic materials contained in these gadgets.  ","We can contribute to the circular economy by developing a comprehensive online platform that connects people who want to lease their unused electronic devices with those in temporary need of such gadgets. This online marketplace would host a range of electronic devices, including computers, laptops, audio equipment, and other peripherals.   By doing so, we reduce the demand for new electronic goods, thus slowing down tech-related waste generation. As for financial impact, the website's leasing model could become a new revenue stream for electronic device owners and an affordable equipment source for consumers, businesses, and even schools and non-profits.   Features of this platform would include user accounts, device listings, transparent ratings and reviews, secure payment processing, lease agreement creation, and a seamless connection with shipping services. Implementation is highly feasible with current e-commerce technologies, and scalability is vast as digital gadgets are universally used and often replaced. The environmental impact is significant, as it directly targets the pressing issue of electronic waste and energy consumption."
